{
  "schema_version": "1.2.0",
  "date": "2026-07-16",
  "timezone": "Asia/Shanghai",
  "window_start": "2026-07-15T17:41:48Z",
  "window_end": "2026-07-16T17:42:12Z",
  "window_quality": {
    "duration_minutes": 1440,
    "valid_for_ranking": true,
    "reason": "valid"
  },
  "candidate_count": 2000,
  "collection": {
    "search_result_counts": {
      "recent_created": 1000,
      "recent_active": 500,
      "established_active": 500
    },
    "unique_discovered_count": 1896,
    "candidate_added_count": 973,
    "candidate_removed_count": 967,
    "api_request_count": 635,
    "api_retry_count": 0,
    "snapshot_expected_count": 2000,
    "snapshot_complete_count": 2000,
    "snapshot_completeness": 1.0
  },
  "language": "Jupyter Notebook",
  "slug": "jupyter-notebook-c98b6019",
  "eligible_count": 5,
  "entries": [
    {
      "repository_id": 895508656,
      "full_name": "microsoft/ai-agents-for-beginners",
      "description": "18 Lessons to Get Started Building AI Agents",
      "language": "Jupyter Notebook",
      "stars_total": 69519,
      "stars_gained": 100,
      "html_url": "https://github.com/microsoft/ai-agents-for-beginners",
      "owner_avatar_url": "https://avatars.githubusercontent.com/u/6154722?v=4",
      "knowledge_url": null,
      "trend_7d": [
        null,
        null,
        null,
        null,
        null,
        null,
        100
      ],
      "rank": 1,
      "rank_change": null
    },
    {
      "repository_id": 655806940,
      "full_name": "microsoft/generative-ai-for-beginners",
      "description": "21 Lessons, Get Started Building with Generative AI ",
      "language": "Jupyter Notebook",
      "stars_total": 113065,
      "stars_gained": 44,
      "html_url": "https://github.com/microsoft/generative-ai-for-beginners",
      "owner_avatar_url": "https://avatars.githubusercontent.com/u/6154722?v=4",
      "knowledge_url": null,
      "trend_7d": [
        null,
        null,
        null,
        null,
        null,
        null,
        44
      ],
      "rank": 2,
      "rank_change": null
    },
    {
      "repository_id": 636693030,
      "full_name": "GoogleCloudPlatform/generative-ai",
      "description": "Sample code and notebooks for Generative AI on Google Cloud, with Gemini Enterprise Agent Platform",
      "language": "Jupyter Notebook",
      "stars_total": 17334,
      "stars_gained": 29,
      "html_url": "https://github.com/GoogleCloudPlatform/generative-ai",
      "owner_avatar_url": "https://avatars.githubusercontent.com/u/2810941?v=4",
      "knowledge_url": null,
      "trend_7d": [
        null,
        null,
        null,
        null,
        null,
        null,
        29
      ],
      "rank": 3,
      "rank_change": null
    },
    {
      "repository_id": 468576060,
      "full_name": "openai/openai-cookbook",
      "description": "Examples and guides for using the OpenAI API",
      "language": "Jupyter Notebook",
      "stars_total": 74712,
      "stars_gained": 13,
      "html_url": "https://github.com/openai/openai-cookbook",
      "owner_avatar_url": "https://avatars.githubusercontent.com/u/14957082?v=4",
      "knowledge_url": null,
      "trend_7d": [
        null,
        null,
        null,
        null,
        null,
        null,
        13
      ],
      "rank": 4,
      "rank_change": null
    },
    {
      "repository_id": 57939112,
      "full_name": "kubernetes/community",
      "description": "Kubernetes Community Documentation",
      "language": "Jupyter Notebook",
      "stars_total": 12935,
      "stars_gained": 2,
      "html_url": "https://github.com/kubernetes/community",
      "owner_avatar_url": "https://avatars.githubusercontent.com/u/13629408?v=4",
      "knowledge_url": null,
      "trend_7d": [
        null,
        null,
        null,
        null,
        null,
        null,
        2
      ],
      "rank": 5,
      "rank_change": null
    }
  ]
}
