{
  "schema_version": "1.2.0",
  "date": "2026-07-16",
  "timezone": "Asia/Shanghai",
  "window_start": "2026-07-15T17:41:48Z",
  "window_end": "2026-07-16T17:42:12Z",
  "window_quality": {
    "duration_minutes": 1440,
    "valid_for_ranking": true,
    "reason": "valid"
  },
  "candidate_count": 2000,
  "collection": {
    "search_result_counts": {
      "recent_created": 1000,
      "recent_active": 500,
      "established_active": 500
    },
    "unique_discovered_count": 1896,
    "candidate_added_count": 973,
    "candidate_removed_count": 967,
    "api_request_count": 635,
    "api_retry_count": 0,
    "snapshot_expected_count": 2000,
    "snapshot_complete_count": 2000,
    "snapshot_completeness": 1.0
  },
  "language": "Dart",
  "slug": "dart-5a5c3f75",
  "eligible_count": 7,
  "entries": [
    {
      "repository_id": 560284721,
      "full_name": "ente/ente",
      "description": "💚 End-to-end encrypted cloud for everything.",
      "language": "Dart",
      "stars_total": 27729,
      "stars_gained": 55,
      "html_url": "https://github.com/ente/ente",
      "owner_avatar_url": "https://avatars.githubusercontent.com/u/64603161?v=4",
      "knowledge_url": null,
      "trend_7d": [
        null,
        null,
        null,
        null,
        null,
        null,
        55
      ],
      "rank": 1,
      "rank_change": null
    },
    {
      "repository_id": 523534328,
      "full_name": "ImranR98/Obtainium",
      "description": "Get Android app updates straight from the source.",
      "language": "Dart",
      "stars_total": 18259,
      "stars_gained": 30,
      "html_url": "https://github.com/ImranR98/Obtainium",
      "owner_avatar_url": "https://avatars.githubusercontent.com/u/30463115?v=4",
      "knowledge_url": null,
      "trend_7d": [
        null,
        null,
        null,
        null,
        null,
        null,
        30
      ],
      "rank": 2,
      "rank_change": null
    },
    {
      "repository_id": 776121034,
      "full_name": "BasedHardware/omi",
      "description": "AI that sees your screen, listens to your conversations and tells you what to do",
      "language": "Dart",
      "stars_total": 13024,
      "stars_gained": 14,
      "html_url": "https://github.com/BasedHardware/omi",
      "owner_avatar_url": "https://avatars.githubusercontent.com/u/162546372?v=4",
      "knowledge_url": null,
      "trend_7d": [
        null,
        null,
        null,
        null,
        null,
        null,
        14
      ],
      "rank": 3,
      "rank_change": null
    },
    {
      "repository_id": 649662864,
      "full_name": "wanghongenpin/proxypin",
      "description": "Open source free capture HTTP(S) traffic  software ProxyPin, supporting full platform systems",
      "language": "Dart",
      "stars_total": 13537,
      "stars_gained": 8,
      "html_url": "https://github.com/wanghongenpin/proxypin",
      "owner_avatar_url": "https://avatars.githubusercontent.com/u/24794200?v=4",
      "knowledge_url": null,
      "trend_7d": [
        null,
        null,
        null,
        null,
        null,
        null,
        8
      ],
      "rank": 4,
      "rank_change": null
    },
    {
      "repository_id": 35726310,
      "full_name": "dart-lang/sdk",
      "description": "The Dart SDK, including the VM, JS and Wasm compilers, analysis, core libraries, and more.",
      "language": "Dart",
      "stars_total": 11211,
      "stars_gained": 2,
      "html_url": "https://github.com/dart-lang/sdk",
      "owner_avatar_url": "https://avatars.githubusercontent.com/u/1609975?v=4",
      "knowledge_url": null,
      "trend_7d": [
        null,
        null,
        null,
        null,
        null,
        null,
        2
      ],
      "rank": 5,
      "rank_change": null
    },
    {
      "repository_id": 151977818,
      "full_name": "felangel/bloc",
      "description": "A predictable state management library that helps implement the BLoC design pattern",
      "language": "Dart",
      "stars_total": 12474,
      "stars_gained": -1,
      "html_url": "https://github.com/felangel/bloc",
      "owner_avatar_url": "https://avatars.githubusercontent.com/u/8855632?v=4",
      "knowledge_url": null,
      "trend_7d": [
        null,
        null,
        null,
        null,
        null,
        null,
        -1
      ],
      "rank": 6,
      "rank_change": null
    },
    {
      "repository_id": 31792824,
      "full_name": "flutter/flutter",
      "description": "Flutter makes it easy and fast to build beautiful apps for mobile and beyond",
      "language": "Dart",
      "stars_total": 177863,
      "stars_gained": -45,
      "html_url": "https://github.com/flutter/flutter",
      "owner_avatar_url": "https://avatars.githubusercontent.com/u/14101776?v=4",
      "knowledge_url": null,
      "trend_7d": [
        null,
        null,
        null,
        null,
        null,
        null,
        -45
      ],
      "rank": 7,
      "rank_change": null
    }
  ]
}
