{
  "schema_version": "1.2.0",
  "date": "2026-07-16",
  "timezone": "Asia/Shanghai",
  "window_start": "2026-07-15T17:41:48Z",
  "window_end": "2026-07-16T17:42:12Z",
  "window_quality": {
    "duration_minutes": 1440,
    "valid_for_ranking": true,
    "reason": "valid"
  },
  "candidate_count": 2000,
  "collection": {
    "search_result_counts": {
      "recent_created": 1000,
      "recent_active": 500,
      "established_active": 500
    },
    "unique_discovered_count": 1896,
    "candidate_added_count": 973,
    "candidate_removed_count": 967,
    "api_request_count": 635,
    "api_retry_count": 0,
    "snapshot_expected_count": 2000,
    "snapshot_complete_count": 2000,
    "snapshot_completeness": 1.0
  },
  "language": "PHP",
  "slug": "php-0a6a1534",
  "eligible_count": 14,
  "entries": [
    {
      "repository_id": 332880689,
      "full_name": "coollabsio/coolify",
      "description": "An open-source, self-hostable PaaS alternative to Vercel, Heroku & Netlify that lets you easily deploy static sites, databases, full-stack applications and 280+ one-click services on your own servers.",
      "language": "PHP",
      "stars_total": 58700,
      "stars_gained": 101,
      "html_url": "https://github.com/coollabsio/coolify",
      "owner_avatar_url": "https://avatars.githubusercontent.com/u/60715044?v=4",
      "knowledge_url": null,
      "trend_7d": [
        null,
        null,
        null,
        null,
        null,
        null,
        101
      ],
      "rank": 1,
      "rank_change": null
    },
    {
      "repository_id": 29745084,
      "full_name": "Leantime/leantime",
      "description": "Leantime is a goals focused project management system for non-project managers. Building with ADHD, Autism, and dyslexia in mind.",
      "language": "PHP",
      "stars_total": 10856,
      "stars_gained": 28,
      "html_url": "https://github.com/Leantime/leantime",
      "owner_avatar_url": "https://avatars.githubusercontent.com/u/11252321?v=4",
      "knowledge_url": null,
      "trend_7d": [
        null,
        null,
        null,
        null,
        null,
        null,
        28
      ],
      "rank": 2,
      "rank_change": null
    },
    {
      "repository_id": 60243197,
      "full_name": "nextcloud/server",
      "description": "☁️ Nextcloud server, a safe home for all your data",
      "language": "PHP",
      "stars_total": 36161,
      "stars_gained": 14,
      "html_url": "https://github.com/nextcloud/server",
      "owner_avatar_url": "https://avatars.githubusercontent.com/u/19211038?v=4",
      "knowledge_url": null,
      "trend_7d": [
        null,
        null,
        null,
        null,
        null,
        null,
        14
      ],
      "rank": 3,
      "rank_change": null
    },
    {
      "repository_id": 2179920,
      "full_name": "woocommerce/woocommerce",
      "description": "A customizable, open-source ecommerce platform built on WordPress. Build any commerce solution you can imagine.",
      "language": "PHP",
      "stars_total": 10397,
      "stars_gained": 4,
      "html_url": "https://github.com/woocommerce/woocommerce",
      "owner_avatar_url": "https://avatars.githubusercontent.com/u/473596?v=4",
      "knowledge_url": null,
      "trend_7d": [
        null,
        null,
        null,
        null,
        null,
        null,
        4
      ],
      "rank": 4,
      "rank_change": null
    },
    {
      "repository_id": 2889328,
      "full_name": "WordPress/WordPress",
      "description": "WordPress, Git-ified. This repository is just a mirror of the WordPress subversion repository. Please do not send pull requests. Submit pull requests to https://github.com/WordPress/wordpress-develop and patches to https://core.trac.wordpress.org/ instead.",
      "language": "PHP",
      "stars_total": 21263,
      "stars_gained": 2,
      "html_url": "https://github.com/WordPress/WordPress",
      "owner_avatar_url": "https://avatars.githubusercontent.com/u/276006?v=4",
      "knowledge_url": null,
      "trend_7d": [
        null,
        null,
        null,
        null,
        null,
        null,
        2
      ],
      "rank": 5,
      "rank_change": null
    },
    {
      "repository_id": 49014795,
      "full_name": "phpstan/phpstan",
      "description": "PHP Static Analysis Tool - discover bugs in your code without running it!",
      "language": "PHP",
      "stars_total": 14037,
      "stars_gained": 2,
      "html_url": "https://github.com/phpstan/phpstan",
      "owner_avatar_url": "https://avatars.githubusercontent.com/u/16435710?v=4",
      "knowledge_url": null,
      "trend_7d": [
        null,
        null,
        null,
        null,
        null,
        null,
        2
      ],
      "rank": 6,
      "rank_change": null
    },
    {
      "repository_id": 97311017,
      "full_name": "rectorphp/rector",
      "description": "Instant Upgrades and Automated Refactoring of any PHP 5.3+ code",
      "language": "PHP",
      "stars_total": 10367,
      "stars_gained": 2,
      "html_url": "https://github.com/rectorphp/rector",
      "owner_avatar_url": "https://avatars.githubusercontent.com/u/32097581?v=4",
      "knowledge_url": null,
      "trend_7d": [
        null,
        null,
        null,
        null,
        null,
        null,
        2
      ],
      "rank": 7,
      "rank_change": null
    },
    {
      "repository_id": 7548986,
      "full_name": "laravel/framework",
      "description": "Laravel is a web application framework with expressive, elegant syntax.",
      "language": "PHP",
      "stars_total": 34797,
      "stars_gained": 1,
      "html_url": "https://github.com/laravel/framework",
      "owner_avatar_url": "https://avatars.githubusercontent.com/u/958072?v=4",
      "knowledge_url": null,
      "trend_7d": [
        null,
        null,
        null,
        null,
        null,
        null,
        1
      ],
      "rank": 8,
      "rank_change": null
    },
    {
      "repository_id": 493550477,
      "full_name": "FOSSBilling/FOSSBilling",
      "description": "Empower your hosting business with FOSSBilling, the free and open-source solution for efficient billing and client management.",
      "language": "PHP",
      "stars_total": 1641,
      "stars_gained": 1,
      "html_url": "https://github.com/FOSSBilling/FOSSBilling",
      "owner_avatar_url": "https://avatars.githubusercontent.com/u/105774900?v=4",
      "knowledge_url": null,
      "trend_7d": [
        null,
        null,
        null,
        null,
        null,
        null,
        1
      ],
      "rank": 9,
      "rank_change": null
    },
    {
      "repository_id": 1548202,
      "full_name": "matomo-org/matomo",
      "description": "Empowering People Ethically 🚀 — Matomo is hiring! Join us → https://matomo.org/jobs Matomo is the leading open-source alternative to Google Analytics, giving you complete control and built-in privacy. Easily collect, visualise, and analyse data from websites & apps. Star us on GitHub ⭐️  – Pull Requests welcome! ",
      "language": "PHP",
      "stars_total": 21691,
      "stars_gained": 0,
      "html_url": "https://github.com/matomo-org/matomo",
      "owner_avatar_url": "https://avatars.githubusercontent.com/u/698038?v=4",
      "knowledge_url": null,
      "trend_7d": [
        null,
        null,
        null,
        null,
        null,
        null,
        0
      ],
      "rank": 10,
      "rank_change": null
    },
    {
      "repository_id": 3431193,
      "full_name": "yiisoft/yii2",
      "description": "Yii 2: The Fast, Secure and Professional PHP Framework",
      "language": "PHP",
      "stars_total": 14300,
      "stars_gained": 0,
      "html_url": "https://github.com/yiisoft/yii2",
      "owner_avatar_url": "https://avatars.githubusercontent.com/u/993323?v=4",
      "knowledge_url": null,
      "trend_7d": [
        null,
        null,
        null,
        null,
        null,
        null,
        0
      ],
      "rank": 11,
      "rank_change": null
    },
    {
      "repository_id": 29126334,
      "full_name": "EasyCorp/EasyAdminBundle",
      "description": "EasyAdmin is a fast, beautiful and modern admin generator for Symfony applications.",
      "language": "PHP",
      "stars_total": 4287,
      "stars_gained": 0,
      "html_url": "https://github.com/EasyCorp/EasyAdminBundle",
      "owner_avatar_url": "https://avatars.githubusercontent.com/u/14944619?v=4",
      "knowledge_url": null,
      "trend_7d": [
        null,
        null,
        null,
        null,
        null,
        null,
        0
      ],
      "rank": 12,
      "rank_change": null
    },
    {
      "repository_id": 15231212,
      "full_name": "Automattic/jetpack",
      "description": "Security, performance, marketing, and design tools — Jetpack is made by WordPress experts to make WP sites safer and faster, and help you grow your traffic.",
      "language": "PHP",
      "stars_total": 1832,
      "stars_gained": 0,
      "html_url": "https://github.com/Automattic/jetpack",
      "owner_avatar_url": "https://avatars.githubusercontent.com/u/887802?v=4",
      "knowledge_url": null,
      "trend_7d": [
        null,
        null,
        null,
        null,
        null,
        null,
        0
      ],
      "rank": 13,
      "rank_change": null
    },
    {
      "repository_id": 46964895,
      "full_name": "star7th/showdoc",
      "description": "ShowDoc is a tool greatly applicable for an IT team to share documents online一个非常适合IT团队的在线API文档、技术文档工具",
      "language": "PHP",
      "stars_total": 12841,
      "stars_gained": -1,
      "html_url": "https://github.com/star7th/showdoc",
      "owner_avatar_url": "https://avatars.githubusercontent.com/u/2200494?v=4",
      "knowledge_url": null,
      "trend_7d": [
        null,
        null,
        null,
        null,
        null,
        null,
        -1
      ],
      "rank": 14,
      "rank_change": null
    }
  ]
}
